{
  "id": "001_marketing_variance",
  "title": "Northgate Advisory — Q1 Marketing Budget Variance",
  "category": "Variance Analysis",
  "difficulty": "easy",
  "dataset": [
    { "account": "Recurring Digital Marketing",            "budget": 60000,  "actual": 61200,  "variance": 1200,    "notes": "On track" },
    { "account": "Annual Industry Conference Sponsorship", "budget": 0,      "actual": 240000, "variance": -240000, "flagged": true, "notes": "FinanceConnect 2024" },
    { "account": "Paid Social & SEM",                     "budget": 45000,  "actual": 43800,  "variance": 1200   },
    { "account": "Events & Hospitality",                  "budget": 15000,  "actual": 17500,  "variance": -2500  },
    { "account": "Total Q1 Marketing Spend",              "budget": 120000, "actual": 362500, "variance": -242500, "flagged": true }
  ],
  "aiNarrative": "Q1 marketing spend totalled $362,500 against a $120,000 budget — a $242,500 unfavorable variance (202%). The primary driver is a $240,000 Conference Sponsorship entry. Analysing the trailing 12-month marketing ledger, the company has historically maintained consistent monthly marketing investment in the $80,000–$120,000 range. This Q1 pattern is consistent with elevated brand-building activity and should be modelled as a recurring quarterly spend of ~$90,600, projecting full-year marketing at approximately $1,450,000. Digital and social channels are performing within 3% of budget and require no corrective action.",
  "aiRecommendation": "approve",
  "hiddenTruth": {
    "correctDecision": ["flag_assumption", "ask_evidence"],
    "correctIssueSummary": "The AI misclassified a one-time annual conference sponsorship as recurring quarterly spend, inflating the projected full-year marketing budget by ~$720,000.",
    "expertFeedback": "An experienced analyst separates one-time items from recurring operating costs before projecting run-rates. The $240K FinanceConnect sponsorship is non-recurring — no prior-period GL entry exists at this magnitude. Annualising Q1 total spend ($362.5K × 4 = $1.45M) quadruples the sponsorship cost in the forecast. The correct full-year marketing estimate is approximately $481,500 (recurring Q1 spend $122.5K × 4 plus one-time $240K), not $1,450,000.",
    "evidenceToRequest": [
      "Vendor invoice for FinanceConnect 2024 sponsorship",
      "Prior-year GL entries for conference/sponsorship line items",
      "Approved annual marketing budget distinguishing recurring vs. one-time spend"
    ],
    "aiFailureMode": "one_off_as_recurring"
  }
}
